分类,学校,院校层次,专业,合作方,2025最低分,2025最低位次,学费(元/年),计划人数,官方录取数据链接,判断理由
分数太高,河南大学,双一流,中外合作办学组(国贸/会计/学前),多国合作,556,23123,18000~25000,-,待查找,比523高33分基本没希望
分数太高,河南财经政法大学,省属重点,金融学(中外合作办学),俄罗斯人民友谊大学,555,23701,18000,-,https://zs.huel.edu.cn/info/1357/3119.htm,比523高32分差距太大
分数太高,河南农业大学,省属重点,中外合作办学组(第203组),-,546,28812,-,-,https://zs.henau.edu.cn/html/detail/enrollment_dynamics/20250821720.html,比523高23分不建议押
可冲,河南师范大学,省属重点,法语(中外合作办学),法国佩皮尼昂大学,525,42821,18000,100,https://www.htu.edu.cn/zs/,仅高2分首选冲刺目标
可冲,郑州大学,211/双一流,风景园林(惠灵顿学院),新西兰惠灵顿维多利亚大学,527,41380,40000,30,https://www7.zzu.edu.cn/wizzu/,高4分211平台性价比极高
可冲,信阳师范大学,省属师范,经济学(中外合作办学),美国米勒斯维尔大学,527,40664,18000,115,https://zs.xynu.edu.cn/info/1006/2818.htm,高4分115人大批量
可冲,郑州大学,211/双一流,建筑学(惠灵顿学院·5年制),新西兰惠灵顿维多利亚大学,528,40663,40000,30,https://www7.zzu.edu.cn/wizzu/,高5分5年制需评估
可冲,河南财经政法大学,省属重点,人文地理与城乡规划(中外合作),俄罗斯人民友谊大学,531,38488,18000,200,https://zs.huel.edu.cn/info/1357/3119.htm,高8分选科地理有优势
稳,许昌学院,公办本科,人力资源管理(中外合作办学),加拿大卡普顿大学,515,50447,待查,70,https://zs.xcu.edu.cn,低8分冲稳之间的安全垫
稳,河南牧业经济学院,公办本科,物流管理(中外合作·霍尔姆斯学院),澳大利亚霍尔姆斯学院,508,56017,待查,70,待查找,低15分大概率能进
保底,商丘师范学院,省属师范,学前教育(中外合作办学·师范),乌克兰尼古拉耶夫国立师范学院,497,65332,18000,90,https://zhaoban.sqnu.edu.cn/info/1005/3550.htm,低26分师范方向确保有学上
保底,南阳师范学院,省属师范,广播电视编导(中外合作办学),韩国全州大学,495,待查,18000,待查,待查找,低28分按文化分录取授艺术学学位
保底,河南牧业经济学院,公办本科,农林经济管理(中外合作·卡洛理工),卡洛理工国际学院,487,74511,~32000,40,待查找,低36分最终兜底
